blog_idea_id,title,body,author,id
1,Python_(programming_language) - Languages influenced by Python,"## The Python Ripple Effect: How Python's Design Influenced a Generation of Languages

Python, the beloved high-level, general-purpose programming language, has carved a significant niche in the software development landscape. Its readability, versatility, and extensive libraries have made it a favorite among beginners and seasoned professionals alike. But Python's influence extends far beyond its own user base. Its elegant design principles, pragmatic philosophy, and even its development practices have rippled outwards, shaping the DNA of numerous other programming languages.

In this blog post, we'll delve into the fascinating world of languages influenced by Python, exploring how Python's key features have been adopted, adapted, and even used as a springboard for entirely new programming paradigms.

**The Pythonic Touch: Syntax and Structure**

One of Python's hallmarks is its clean and readable syntax, largely achieved through the use of significant whitespace – indentation to define code blocks. This seemingly simple choice has had a profound impact on the aesthetic and usability of other languages.

*   **Boo:** Boo, a .NET programming language, embraces Python's indentation-based syntax and even adopts a similar object model. This makes Boo feel familiar to Python developers while leveraging the power of the .NET framework.

*   **Cobra:** Cobra, designed with clarity and conciseness in mind, openly acknowledges Python as a key inspiration. Its syntax echoes Python's, and the language's official documentation explicitly lists Python as a primary influence.

*   **CoffeeScript:** Before JavaScript's modern evolution, CoffeeScript aimed to provide a more elegant and Python-inspired syntax that would then compile into JavaScript. This allowed developers to write JavaScript code with increased ease and readability, subtly infusing the JavaScript ecosystem with Pythonic sensibilities.

*   **GDScript:** Game development often demands rapid prototyping and scripting capabilities. Godot, a popular open-source game engine, tackles this with GDScript, a language deliberately designed to resemble Python. This familiarity lowers the barrier to entry for developers and makes scripting game logic a more intuitive process.

*   **Nim:** Another language sporting Python's reliance on indentation and similar syntax is Nim. It combines this with strong static typing, offering a blend of performance and readability.

These languages demonstrate how Python's syntactical choices have influenced the design of languages aiming for cleaner, more readable codebases.

**Beyond Syntax: Deeper Influences**

Python's influence goes beyond mere syntax. Its core concepts and design philosophy have been adopted and adapted in various ways.

*   **ECMAScript/JavaScript:** While not a direct clone, JavaScript has directly borrowed specific language features from Python. Iterators and generators, powerful tools for working with sequences of data in a memory-efficient manner, were adopted from Python, enriching JavaScript's capabilities for asynchronous programming and data manipulation.

*   **Go:** Go, Google's system programming language, was designed with developer productivity in mind. One of its core goals was to offer ""speed of working in a dynamic language like Python."" While Go is a statically typed language, it shares Python's syntax for slicing arrays, a feature that simplifies working with data structures.

*   **Groovy:** Groovy, a dynamic language for the Java Virtual Machine (JVM), was specifically motivated by a desire to incorporate the Python design philosophy into the Java ecosystem. This means emphasizing simplicity, readability, and ease of use, bringing Python's spirit to the world of Java development.

*   **Julia:** Julia, a high-performance language for scientific computing, aimed to bridge the gap between dynamic scripting languages and compiled languages. One of its core design goals was to be ""as usable for general programming as Python,"" indicating a desire to replicate Python's widespread applicability and ease of use.

*   **Mojo:** Mojo is emerging as an interesting language that aims to be a non-strict superset of Python. This means you can write standard Python code in Mojo and gradually introduce new features like structs and omit classes for performance gains. This approach allows a gradual transition from Python while leveraging Mojo's speed.

*   **Kotlin:** Designed to overcome the verbosity of Java, Kotlin elegantly weaves in features inspired by both Python and Java. Its combination of concise syntax and advanced features aims to minimize boilerplate code and enhance developer efficiency, reflecting Python's focus on developer productivity.

**A Different Kind of Influence: Inspiration vs. Replication**

It's crucial to note that the influence of Python isn't always about direct replication. Sometimes, it serves as a point of departure, a benchmark against which other languages are measured.

*   **Ruby:** Yukihiro Matsumoto, the creator of Ruby, explicitly stated that his goal was to create a scripting language that was ""more powerful than Perl, and more object-oriented than Python."" This shows that Python served as a reference point, a known quantity that informed the design decisions behind Ruby.

*   **Swift:** Apple's Swift also shows some traces of Python-inspired syntax, particularly in areas like optional binding and tuple handling. While Swift has its own unique character, the subtle influences of Python contribute to its overall elegance and usability.

**Beyond the Code: Python's Development Practices**

Python's influence isn't limited to language features. Its development practices have also been emulated by other communities.

*   **Python Enhancement Proposals (PEPs):** Python uses a system of Python Enhancement Proposals (PEPs) to document the rationale and context for any significant language change. This transparent and collaborative process ensures that changes are well-considered and aligned with the language's overall goals. This practice has been adopted by other languages like Tcl, Erlang, and Swift, demonstrating the impact of Python's open and well-documented development approach.

**Conclusion: The Enduring Legacy of Python**

Python's influence on the programming landscape is undeniable. From its syntax and design philosophy to its development practices, Python has served as a source of inspiration, a benchmark to surpass, and a model to emulate. As new languages continue to emerge, the Python ripple effect will likely continue to shape the future of software development, leaving an enduring legacy that extends far beyond its own ever-growing community. Whether it's through the adoption of indentation-based syntax, the borrowing of specific features, or the emulation of its collaborative development model, Python's impact on the evolution of programming languages is profound and far-reaching.
",Gemini,1
2,Python_(programming_language) - Types of Use,"## Python: A Language Forged in Versatility - Exploring its Diverse Applications

Python. The name conjures up images of sleek code, elegant syntax, and a surprisingly powerful ecosystem. But beyond the initial impression, lies a programming language whose true strength lies in its incredible versatility. From crafting dynamic web applications to powering cutting-edge AI, Python's adaptability has cemented its place as a cornerstone technology across countless industries. Let's dive into the diverse range of applications where Python truly shines.

**1. Web Development: From Scripting to Sophisticated Frameworks**

Python's role in web development is significant, to say the least. Its ability to act as a scripting language, particularly with modules like `mod_wsgi` for the Apache web server, allows developers to create dynamic and interactive web experiences. The evolution of the Web Server Gateway Interface (WSGI) has further standardized the development process, fostering a vibrant ecosystem of web frameworks designed to streamline the creation of complex web applications.

Consider these powerful tools:

*   **Django:** A high-level framework emphasizing rapid development and clean, pragmatic design. Django's ""batteries-included"" approach provides built-in features for common web development tasks, making it suitable for building robust and scalable web applications.
*   **Flask:** A microframework that offers flexibility and control. Flask's lightweight nature makes it ideal for building smaller applications, APIs, or projects where developers need more granular control over the framework's behavior.
*   **Pyramid, TurboGears, web2py, Tornado, Bottle, and Zope:** Each of these frameworks offers unique features and caters to different development styles, providing developers with a wide range of options to choose from.

Furthermore, Python enables client-side development through tools like `Pyjs` and `IronPython`, facilitating the creation of Ajax-based applications. Libraries like `SQLAlchemy` simplify database interactions by acting as a data mapper to relational databases. Even complex tasks like inter-computer communication are handled by frameworks like `Twisted`, the very framework powering the infrastructure of Dropbox.

**2. Scientific Computing: Analyzing Data and Modeling the World**

Python's impact on scientific computing is undeniable. Its clean syntax and extensive libraries make it a favorite amongst scientists, researchers, and engineers. Libraries such as `NumPy` for numerical computation, `SciPy` for advanced scientific and mathematical algorithms, and `Matplotlib` for creating visualizations, provide the foundation for analyzing data, running simulations, and modeling complex systems.

Specific scientific domains benefit from specialized libraries:

*   **Biopython:** For bioinformatics and computational biology, providing tools for working with biological data like sequences and structures.
*   **Astropy:** For astronomy and astrophysics, offering functionality for handling astronomical data, performing calculations, and creating visualizations.

Furthermore, tools like `SageMath`, a comprehensive computer algebra system programmable in Python, provide a notebook interface for exploring mathematical concepts across algebra, combinatorics, numerical mathematics, number theory, and calculus. `OpenCV`, with its Python bindings, empowers developers with a rich set of features for computer vision and image processing.

**3. Artificial Intelligence and Machine Learning: The Engine of Innovation**

Python has become the dominant language in the fields of artificial intelligence (AI) and machine learning (ML). Its ease of use, extensive libraries, and strong community support have made it the go-to choice for researchers and practitioners alike.

Key libraries driving this revolution include:

*   **TensorFlow:** Developed by Google, TensorFlow is a powerful framework for building and training machine learning models, particularly deep neural networks.
*   **Keras:** A high-level API that simplifies the development of neural networks, making it easier to prototype and experiment with different architectures.
*   **PyTorch:** A flexible and dynamic framework favored by researchers for its ease of use and support for cutting-edge research.
*   **scikit-learn:** A comprehensive library providing a wide range of machine learning algorithms, including classification, regression, clustering, and dimensionality reduction.
*   **ProbLog:** A probabilistic logic programming language, extending Python's capabilities for reasoning under uncertainty.

Python's versatility as a scripting language, modular architecture, simple syntax, and powerful text processing tools also make it ideal for natural language processing (NLP), a critical area within AI.

Going further, the combination of Python and Prolog, a logic programming language, has proven useful in AI applications, particularly in areas like natural language processing, visual query answering, geospatial reasoning, and handling semantic web data. Systems like Janus exploit the similarities between the two languages to create powerful AI solutions.  The Natlog system also showcases Python's involvement, using Definite Clause Grammars (DCGs) to create prompts for text-to-text and text-to-image generators.

**4. Graphical User Interfaces (GUIs) and Desktop Environments: Building Interactive Experiences**

Python isn't just about backend processing; it's also capable of creating interactive user interfaces. Libraries like `Tkinter`, Python's standard GUI package, allow developers to build cross-platform desktop applications.  In fact, the Sugar desktop environment for the One Laptop per Child (OLPC) XO computer was largely written in Python, highlighting its capability for building entire desktop environments.

**5. Embedded Scripting: Powering Software and Hardware**

Python's embeddability makes it a valuable tool for extending the functionality of other software and hardware products.  It's integrated into a wide range of applications, including:

*   **Finite element method software (Abaqus):** Allowing users to customize simulations and automate analysis.
*   **3D parametric modelers (FreeCAD):** Enabling users to create custom tools and scripts for designing 3D models.
*   **3D animation packages (3ds Max, Blender, Cinema 4D, Lightwave, Houdini, Maya, modo, MotionBuilder, Softimage):** Providing a scripting interface for automating tasks, creating custom tools, and extending the capabilities of these powerful programs.
*   **Visual effects compositors (Nuke):** Allowing artists to automate workflows, create custom effects, and integrate Python tools into their pipelines.
*   **2D imaging programs (GIMP, Inkscape, Scribus, Paint Shop Pro):** Enabling users to write scripts for image processing, vector graphics editing, and desktop publishing.
*   **Musical notation programs (scorewriter and capella):** For creating custom tools and workflows for music composition and notation.

Even the GNU Debugger utilizes Python to enhance its debugging capabilities, displaying complex data structures in a more readable format.  Esri promotes Python as the scripting language of choice for ArcGIS. Python has also been used in video game development and was even one of the first languages supported by Google App Engine. Notably, LibreOffice includes Python, with plans to eventually replace Java within the suite.

On the hardware front, the Raspberry Pi single-board computer has embraced Python as its primary language, making it accessible to beginners and experts alike for a multitude of projects.

**6. Operating Systems: A Core Component**

Python is a standard component of many operating systems, including most Linux distributions, AmigaOS 4, FreeBSD, NetBSD, and OpenBSD. It's readily accessible from the command line and is even used in the installers of popular Linux distributions like Ubuntu (Ubiquity installer), Red Hat Linux, and Fedora Linux (Anaconda installer). Gentoo Linux leverages Python in its package management system, Portage.

**7. Information Security: A Key Tool for Security Professionals**

Python's versatility and ease of use make it a powerful tool in the information security (infosec) industry. It's used extensively in tasks such as penetration testing, vulnerability analysis, and exploit development. Security professionals rely on Python for tasks ranging from writing custom security tools to automating security audits.

**Conclusion: A Language for the Future**

Python's widespread adoption across diverse fields is a testament to its power and versatility.  Its ease of learning, coupled with its extensive libraries and strong community support, ensures that it will continue to be a driving force in innovation for years to come. Whether you're a web developer, a scientist, an AI researcher, or a security professional, Python offers the tools and flexibility you need to tackle complex problems and build innovative solutions. As technology continues to evolve, Python remains a fundamental language for shaping the future.
",Gemini,2
3,Python_(programming_language) - Popularity,"## Python's Reign: Why This Language Dominates the Programming World

For decades, the world of programming languages has been a dynamic landscape, constantly shifting with the emergence of new technologies and evolving demands. But one language has consistently climbed the ranks, solidifying its position as a frontrunner: Python. But why is Python so popular? It's not just a fleeting trend; Python's dominance is built on a foundation of readability, versatility, and powerful applications. Let's delve into the factors that contribute to Python's widespread adoption and enduring appeal.

**A Consistent Contender: Python's Rise to the Top**

Since 2003, Python has been a constant presence in the top ten of the TIOBE Programming Community Index, a key indicator of language popularity. This isn't just about passively occupying a spot; Python has been actively climbing. As of December 2022, it proudly held the title of the *most* popular language according to the TIOBE Index.

But the accolades don't stop there. Python has been crowned ""Programming Language of the Year"" by TIOBE in 2007, 2010, 2018, and 2020. This prestigious award is given to the language that demonstrates the ""highest rise in ratings in a year."" What's even more remarkable is that Python is the *only* language to have achieved this honor four times as of 2020, a testament to its continuous growth and increasing relevance.

So, how does the TIOBE Index measure popularity? It's based on a comprehensive analysis of search engine data from platforms like Google, Amazon, Wikipedia, Bing, and 20 other prominent online sources. The volume of searches related to a programming language provides valuable insight into its demand and usage within the developer community. The TIOBE graph clearly illustrates Python's upward trajectory since the early 2000s. It shows Python surpassing well-established languages like C, C++, and Java, a feat that underscores its growing influence and adoption.

**The Pillars of Popularity: Readability, Versatility, and Powerful Applications**

Several key factors have fueled Python's remarkable rise:

*   **Readable Syntax:** One of Python's most significant advantages is its clear and concise syntax. Designed to be readable, Python code resembles plain English, making it easier to learn, understand, and maintain. This readability not only simplifies the development process but also reduces the likelihood of errors. It allows developers to focus on problem-solving rather than wrestling with complex syntax, boosting productivity and fostering collaboration.

*   **Comprehensive Standard Library:** Python comes equipped with a rich and extensive standard library, a collection of pre-written modules and functions that provide out-of-the-box solutions for a wide range of tasks. This library covers areas such as string manipulation, file I/O, networking, and web development. By leveraging the standard library, developers can avoid reinventing the wheel and accelerate their development process.

*   **Application in Data Science and Machine Learning:** The explosive growth of data science and machine learning has played a pivotal role in Python's surge in popularity. Python has become the *de facto* standard for these fields, thanks to its powerful libraries like NumPy, Pandas, Scikit-learn, and TensorFlow. These libraries provide the tools and algorithms necessary for data analysis, machine learning model development, and artificial intelligence applications. Python's versatility and extensive ecosystem have made it an indispensable asset for data scientists and machine learning engineers.

**Industry Giants Embrace Python: A Vote of Confidence**

The adoption of Python by numerous large organizations serves as a powerful endorsement of its capabilities and reliability. Companies like Wikipedia, Google, Yahoo!, CERN, NASA, Facebook, Amazon, Instagram, and Spotify all rely on Python for various aspects of their operations. Even entities such as Industrial Light & Magic and ITA, which have rigorous technical demands, utilise Python. The social news networking site Reddit was built predominantly using Python, highlighting its capabilities when constructing large-scale and complex online systems. Further, organisations such as Discord and Baidu, use Python in certain aspects of their business, acknowledging its usefulness in various applications.

**Conclusion: Python's Enduring Legacy**

Python's popularity is not a mere fad. It's a testament to its design principles, versatile applications, and thriving community. Its readability makes it accessible to beginners, while its powerful libraries and frameworks make it a valuable tool for experienced developers. As data science, machine learning, and web development continue to evolve, Python is well-positioned to remain a dominant force in the programming world for years to come. Its enduring legacy is sealed, and its future looks brighter than ever.
",Gemini,3
4,Python_(programming_language) - Naming,"## Beyond Snakes: Unveiling the Story Behind Python's Quirky Name

Python. The name conjures images of sleek, powerful code, shaping everything from web applications to complex machine learning models. But have you ever stopped to wonder why it's called *Python*? Is there a hidden meaning relating to its functionality, a clever acronym, or some deep symbolic resonance? The reality, as is often the case with the best stories, is far more whimsical and delightfully unexpected.

The truth is, Python's name has absolutely nothing to do with the slithery reptile. Instead, it's a tribute to the absurd brilliance of British comedy troupe Monty Python's Flying Circus.

**Guido van Rossum's Hilarious Inspiration:**

Python's creator, Guido van Rossum, embarked on his journey to design a successor to the ABC programming language in the late 1980s. During this time, he was a dedicated fan of Monty Python's Flying Circus. He wanted a name that was short, unique, and slightly mysterious. The name ""Python,"" with its association to the quirky humor he enjoyed, fit the bill perfectly.

""I chose Python as a working title for the project, being in a slightly irreverent mood, and still think it's a great name,"" Van Rossum confessed. The irreverence, it seems, was key to his vision for a programming language that was powerful yet readable and enjoyable to use.

**Monty Python References in Python Culture:**

The Monty Python influence extends far beyond just the name. It's woven into the very fabric of Python's culture and documentation.

*   **Metasyntactic Variables: Spam and Eggs:** In programming, *metasyntactic variables* are placeholder names used in examples and documentation. While ""foo"" and ""bar"" are common choices, Python often opts for ""spam"" and ""eggs"" – a direct reference to the classic Monty Python sketch about a cafe menu overloaded with spam. This playful choice highlights the language's ethos of accessibility and approachability.

*   **Hidden Gems in the Documentation:** The official Python documentation is known for its clarity and comprehensiveness. But eagle-eyed readers can often spot subtle nods to Monty Python routines. These Easter eggs add a touch of levity and reinforce the connection to the source of inspiration.

*   **The Pythonista Community:** Python users are affectionately referred to as ""Pythonistas."" This moniker reflects the vibrant and passionate community that has grown around the language, fostering collaboration, innovation, and a shared appreciation for Python's unique spirit.

**The ""Py"" Affix: A Sign of Pythonic Origin:**

The name ""Python"" has also spawned a convention: prefixing application names with ""Py"" to indicate that they are built using Python. This practice helps to identify Python-related projects and reinforces the language's branding. Some notable examples include:

*   **Pygame:** A popular binding of the Simple DirectMedia Layer (SDL) library to Python, Pygame empowers developers to create games and multimedia applications with ease.
*   **PyQt and PyGTK:** These libraries provide Python bindings for the Qt and GTK graphical user interface (GUI) toolkits, respectively. They enable developers to craft cross-platform desktop applications with native-looking interfaces.
*   **PyPy:** A fascinating Python implementation originally written in, well, Python! PyPy focuses on speed and flexibility, offering an alternative to the standard CPython interpreter.
*   **NumPy:** A cornerstone library for numerical computing in Python, NumPy provides powerful tools for working with arrays, matrices, and mathematical functions. It's essential for data science, scientific computing, and engineering applications.

**More Than Just a Name: A Testament to Playfulness and Innovation:**

Python's name is more than just a quirky anecdote. It reflects the language's broader philosophy: a blend of power and simplicity, practicality and playfulness. Guido van Rossum's choice to name his creation after Monty Python's Flying Circus speaks volumes about his vision for a language that is both robust and accessible, capable of tackling complex problems while remaining a joy to use. The name has fostered a playful and welcoming community, attracting a diverse range of developers and contributing to the language's continued success. So, the next time you write a line of Python code, remember the spam, the eggs, and the Flying Circus – and appreciate the rich history and quirky inspiration behind the name.
",Gemini,4
